{
  "$schema": "http://json-schema.org/draft-07/schema#",
  "$id": "https://github.com/BEARME-A/LEE3D-Lib/schema/profile.schema.json",
  "title": "LEE3D profile",
  "description": "The single artefact that flows between the three repos: the studio writes it, the exact backend builds from it, and this library stores it.\n\nWHY EVERY KEY CARRIES `x-read-by`. Four bugs in one month were all the same shape — one end knowing about a key the other did not. Pockets were dropped from every STEP export; extra views were ignored without a word; per-face wall thickness was honoured by one builder and not the other, then not by the backend either. None raised an error. This field makes that class of bug visible in the contract itself: if a key says [studio, exact] and only one of them reads it, that is the bug, written down.\n\n`additionalProperties` is deliberately true. A saved model must never fail to load because it carries something this file has not been taught yet — but anything the engine actually depends on belongs here.",
  "type": "object",
  "required": [
    "length",
    "topProfile",
    "widthProfile"
  ],
  "additionalProperties": true,
  "properties": {
    "adaptiveWall": {
      "description": "RETIRED. Honoured so older files load unchanged, off otherwise: measured across ten geometries it never once produced a clean win.",
      "x-read-by": [
        "studio"
      ],
      "type": "boolean"
    },
    "arcSegments": {
      "description": "Points around each section.",
      "x-read-by": [
        "studio"
      ],
      "type": "integer",
      "minimum": 3
    },
    "bottomPoly": {
      "description": "Underside silhouette. Material exists only where every view agrees. null = not traced.",
      "x-read-by": [
        "studio"
      ],
      "oneOf": [
        {
          "type": "array",
          "minItems": 3,
          "items": {
            "type": "array",
            "minItems": 2,
            "maxItems": 2,
            "items": {
              "type": "number"
            }
          }
        },
        {
          "type": "null"
        }
      ]
    },
    "bottomProfile": {
      "description": "Underside height along the length. null = a flat floor.",
      "x-read-by": [
        "studio"
      ],
      "oneOf": [
        {
          "type": "array",
          "items": {
            "type": "array",
            "minItems": 2,
            "maxItems": 2,
            "items": {
              "type": "number"
            }
          }
        },
        {
          "type": "null"
        }
      ]
    },
    "carveMode": {
      "description": "Which engine cuts the details. 'field' carves them into the distance field so the wall under a pocket survives; 'stamp' presses them onto the meshed surface, which is faster but halves the wall beneath. Absent means field for a new model, stamp for an older file.",
      "x-read-by": [
        "studio"
      ],
      "type": "string",
      "enum": [
        "field",
        "stamp"
      ]
    },
    "category": {
      "description": "Folder it is filed under in the library.",
      "x-read-by": [
        "studio"
      ],
      "type": "string"
    },
    "closedBottom": {
      "description": "Seal the underside. False leaves it open, which a toy frame usually wants.",
      "x-read-by": [
        "studio"
      ],
      "type": "boolean"
    },
    "extraViews": {
      "type": "array",
      "description": "Silhouettes from ARBITRARY directions — the groundwork for building from photographs. Each removes material like the three axis views do. The exact build cannot use these and reports how many it had to ignore, because a model using them comes out FATTER there.",
      "x-read-by": [
        "studio",
        "exact"
      ],
      "items": {
        "type": "object",
        "required": [
          "poly"
        ],
        "properties": {
          "dir": {
            "type": "array",
            "minItems": 3,
            "maxItems": 3,
            "items": {
              "type": "number"
            },
            "description": "Which way the camera looks."
          },
          "up": {
            "type": "array",
            "minItems": 3,
            "maxItems": 3,
            "items": {
              "type": "number"
            }
          },
          "from": {
            "type": "array",
            "minItems": 3,
            "maxItems": 3,
            "items": {
              "type": "number"
            },
            "description": "Camera position. Present = perspective, and `poly` is then in normalised image coordinates rather than millimetres."
          },
          "poly": {
            "type": "array",
            "minItems": 3,
            "items": {
              "type": "array",
              "minItems": 2,
              "maxItems": 2,
              "items": {
                "type": "number"
              }
            }
          }
        }
      }
    },
    "features": {
      "type": "array",
      "description": "Carved details. Depth is negative for a pocket, positive for a raise. `through` cuts all the way. A feature with NO depth is a mask or label and has no solid meaning.",
      "x-read-by": [
        "studio",
        "exact"
      ],
      "items": {
        "type": "object",
        "properties": {
          "kind": {
            "type": "string"
          },
          "name": {
            "type": "string"
          },
          "view": {
            "type": "string",
            "enum": [
              "side",
              "sideR",
              "top",
              "bottom",
              "front",
              "rear"
            ],
            "description": "Which face it was drawn on. Decides which way it goes in, and for a finite-depth pocket, where the floor lands."
          },
          "depth": {
            "type": "number",
            "description": "mm. Negative cuts, positive raises."
          },
          "through": {
            "type": "boolean"
          },
          "soft": {
            "type": "number"
          },
          "poly": {
            "type": "array",
            "minItems": 3,
            "items": {
              "type": "array",
              "minItems": 2,
              "maxItems": 2,
              "items": {
                "type": "number"
              }
            }
          }
        }
      }
    },
    "fieldHollow": {
      "description": "Hollow by carving the distance field rather than pushing the mesh inward. Default true, and the reason a thin section does not weld into a plank.",
      "x-read-by": [
        "studio"
      ],
      "type": "boolean"
    },
    "frontHull": {
      "description": "Front-end outline, when the nose is traced separately.",
      "x-read-by": [
        "studio"
      ]
    },
    "frontPoly": {
      "description": "Front silhouette, 0..1 of width by 0..1 of height. Material exists only where every view agrees. null = not traced.",
      "x-read-by": [
        "studio",
        "exact"
      ],
      "oneOf": [
        {
          "type": "array",
          "minItems": 3,
          "items": {
            "type": "array",
            "minItems": 2,
            "maxItems": 2,
            "items": {
              "type": "number"
            }
          }
        },
        {
          "type": "null"
        }
      ]
    },
    "hgtMM": {
      "description": "Height override in mm, 0 = derive from topProfile.",
      "x-read-by": [
        "studio"
      ],
      "type": "number"
    },
    "hullCrisp": {
      "description": "0 = the smooth rounded body, 1 = exactly the traced outline. Follow my drawing only.",
      "x-read-by": [
        "studio"
      ],
      "type": "number",
      "minimum": 0,
      "maximum": 1
    },
    "hullFast": {
      "description": "Set only during a drag, for a provisional build. Never saved deliberately.",
      "x-read-by": [
        "studio"
      ],
      "type": "boolean"
    },
    "hullHollow": {
      "description": "Build it as a shell rather than a solid lump.",
      "x-read-by": [
        "studio",
        "exact"
      ],
      "type": "boolean"
    },
    "hullQuality": {
      "description": "Build quality. Scales BOTH the resolution request and its cap — scaling only the cap does nothing on most models.",
      "x-read-by": [
        "studio"
      ],
      "type": "string",
      "enum": [
        "fast",
        "normal",
        "fine"
      ]
    },
    "hullRes": {
      "type": [
        "integer",
        "null"
      ],
      "description": "Explicit carve grid resolution. Normally derived from stations; capped in the app.",
      "x-read-by": [
        "studio"
      ]
    },
    "length": {
      "description": "Nose to tail in mm. The dimension everything else scales from.",
      "x-read-by": [
        "studio",
        "exact"
      ],
      "type": "number",
      "exclusiveMinimum": 0
    },
    "mode": {
      "description": "Which builder runs. 'projection' is Follow my drawing (carves the intersection of the traced outlines); 'loft' is Smooth (lofts sections).",
      "x-read-by": [
        "studio"
      ],
      "type": "string",
      "enum": [
        "projection",
        "loft",
        "revolve"
      ]
    },
    "modelScale": {
      "description": "The denominator of the scale the model is built at: 200 means 1:200. Optional; absent or 1 means the model IS the real size, which is how every car profile behaves.",
      "x-read-by": [
        "studio",
        "exact"
      ],
      "type": "number",
      "exclusiveMinimum": 0
    },
    "name": {
      "description": "What the person called it.",
      "x-read-by": [
        "studio",
        "exact"
      ],
      "type": "string"
    },
    "noDetail": {
      "description": "Build the plain body and skip every feature.",
      "x-read-by": [
        "studio"
      ],
      "type": "boolean"
    },
    "notchDepth": {
      "description": "Depth for notch-style features.",
      "x-read-by": [
        "studio"
      ],
      "type": "number"
    },
    "notchFaceOnly": {
      "description": "A notch cuts from its own face only, never through.",
      "x-read-by": [
        "studio"
      ],
      "type": "boolean"
    },
    "openArches": {
      "description": "Open the wheel arches. Older name for openUnderside; both are written so older files still load.",
      "x-read-by": [
        "studio"
      ],
      "type": "boolean"
    },
    "openUnderside": {
      "description": "Open the underside under the arches.",
      "x-read-by": [
        "studio"
      ],
      "type": "boolean"
    },
    "plainFrame": {
      "description": "Suppress decorative geometry.",
      "x-read-by": [
        "studio"
      ],
      "type": "boolean"
    },
    "realLength": {
      "description": "How long the real thing is, in mm. A 24m building is 24000. Optional, and purely a record: `length` remains the model size that all geometry is built from, so a profile without this behaves exactly as before.",
      "x-read-by": [
        "studio",
        "exact"
      ],
      "type": "number",
      "exclusiveMinimum": 0
    },
    "revHeight": {
      "description": "How tall a turned object is, in mm. Kept separately because `length` for a fountain is its DIAMETER, so falling back to it returns a squat model.",
      "x-read-by": [
        "studio",
        "exact"
      ],
      "type": "number",
      "exclusiveMinimum": 0
    },
    "revLen": {
      "description": "Revolve length in mm. Revolve mode only; the exact build does not claim to build these.",
      "x-read-by": [
        "studio"
      ]
    },
    "revProfile": {
      "description": "Revolve outline. Revolve mode only; the exact build does not claim to build these.",
      "x-read-by": [
        "studio"
      ]
    },
    "revProfileV": {
      "description": "Radius against height for a turned object: [[height fraction, radius mm], …], read off the traced side elevation, where each height's radius is half the outline's width there. Only meaningful when shape is \"lathe\".",
      "x-read-by": [
        "studio",
        "exact"
      ],
      "type": "array"
    },
    "revShape": {
      "description": "Revolve profile family. Revolve mode only; the exact build does not claim to build these.",
      "x-read-by": [
        "studio"
      ]
    },
    "revSize": {
      "description": "Revolve size in mm. Revolve mode only; the exact build does not claim to build these.",
      "x-read-by": [
        "studio"
      ]
    },
    "roofFlatness": {
      "description": "How square the roof sits over the sections. Smooth only.",
      "x-read-by": [
        "studio"
      ],
      "type": "number"
    },
    "schema": {
      "description": "Schema version this profile was written against.",
      "x-read-by": [
        "studio"
      ],
      "type": "string"
    },
    "sculpt": {
      "type": [
        "array",
        "null"
      ],
      "description": "Per-vertex offsets from hand sculpting.",
      "x-read-by": [
        "studio"
      ]
    },
    "sculptStrokes": {
      "type": [
        "array",
        "null"
      ],
      "description": "The strokes that produced the sculpt, kept so it can be re-applied.",
      "x-read-by": [
        "studio"
      ]
    },
    "section": {
      "description": "Cross-section shape for the loft builder.",
      "x-read-by": [
        "studio"
      ]
    },
    "sections": {
      "type": [
        "array",
        "null"
      ],
      "description": "Named cross-sections at positions along the length.",
      "x-read-by": [
        "studio"
      ]
    },
    "sepBottom": {
      "description": "Export the floor as a separate piece.",
      "x-read-by": [
        "studio",
        "exact"
      ],
      "type": "boolean"
    },
    "shape": {
      "description": "Section family for the loft builder.",
      "x-read-by": [
        "exact",
        "studio"
      ],
      "type": "string"
    },
    "sidePoly": {
      "description": "Side silhouette (left flank), in 0..1 of length by 0..1 of height. Material exists only where every view agrees. null = not traced.",
      "x-read-by": [
        "studio",
        "exact"
      ],
      "oneOf": [
        {
          "type": "array",
          "minItems": 3,
          "items": {
            "type": "array",
            "minItems": 2,
            "maxItems": 2,
            "items": {
              "type": "number"
            }
          }
        },
        {
          "type": "null"
        }
      ]
    },
    "sidePolyR": {
      "description": "Right flank, when it differs from the left. Absent means symmetric. Material exists only where every view agrees. null = not traced.",
      "x-read-by": [
        "studio",
        "exact"
      ],
      "oneOf": [
        {
          "type": "array",
          "minItems": 3,
          "items": {
            "type": "array",
            "minItems": 2,
            "maxItems": 2,
            "items": {
              "type": "number"
            }
          }
        },
        {
          "type": "null"
        }
      ]
    },
    "stations": {
      "description": "Sections along the length. Also sets the default grid resolution for the carve.",
      "x-read-by": [
        "studio"
      ],
      "type": "integer",
      "minimum": 4
    },
    "topPoly": {
      "description": "Plan silhouette, 0..1 of length by 0..1 of width. Material exists only where every view agrees. null = not traced.",
      "x-read-by": [
        "studio",
        "exact"
      ],
      "oneOf": [
        {
          "type": "array",
          "minItems": 3,
          "items": {
            "type": "array",
            "minItems": 2,
            "maxItems": 2,
            "items": {
              "type": "number"
            }
          }
        },
        {
          "type": "null"
        }
      ]
    },
    "topProfile": {
      "type": "array",
      "items": {
        "type": "array",
        "minItems": 2,
        "maxItems": 2,
        "items": {
          "type": "number"
        }
      },
      "description": "Height along the length, as [fraction, mm] pairs.",
      "x-read-by": [
        "studio",
        "exact"
      ]
    },
    "trace": {
      "description": "Reference images and their placement. Not geometry.",
      "x-read-by": [
        "studio"
      ]
    },
    "units": {
      "description": "Always mm. Present for readers that cannot assume.",
      "x-read-by": [
        "studio"
      ],
      "type": "string",
      "enum": [
        "mm"
      ]
    },
    "wallBottom": {
      "description": "Floor thickness in mm.",
      "x-read-by": [
        "studio",
        "exact"
      ],
      "type": "number",
      "exclusiveMinimum": 0
    },
    "wallPerFace": {
      "description": "Use the three values below instead of one wall.",
      "x-read-by": [
        "studio"
      ],
      "type": "boolean"
    },
    "wallSide": {
      "description": "Flank thickness in mm.",
      "x-read-by": [
        "studio",
        "exact"
      ],
      "type": "number",
      "exclusiveMinimum": 0
    },
    "wallThickness": {
      "description": "Wall in mm, when every face is the same.",
      "x-read-by": [
        "studio",
        "exact"
      ],
      "type": "number",
      "exclusiveMinimum": 0
    },
    "wallTop": {
      "description": "Roof thickness in mm. This is the load-bearing control — a thick floor to bolt through with thin walls elsewhere.",
      "x-read-by": [
        "studio",
        "exact"
      ],
      "type": "number",
      "exclusiveMinimum": 0
    },
    "widMM": {
      "description": "Width override in mm, 0 = derive from widthProfile.",
      "x-read-by": [
        "studio"
      ],
      "type": "number"
    },
    "widthBottomProfile": {
      "description": "Half width at the floor, where it differs from the widest point. null = same as widthProfile.",
      "x-read-by": [
        "studio"
      ],
      "oneOf": [
        {
          "type": "array",
          "items": {
            "type": "array",
            "minItems": 2,
            "maxItems": 2,
            "items": {
              "type": "number"
            }
          }
        },
        {
          "type": "null"
        }
      ]
    },
    "widthProfile": {
      "type": "array",
      "items": {
        "type": "array",
        "minItems": 2,
        "maxItems": 2,
        "items": {
          "type": "number"
        }
      },
      "description": "HALF width along the length, as [fraction, mm]. Half, not full — the body is mirrored about its centreline.",
      "x-read-by": [
        "studio",
        "exact"
      ]
    }
  }
}
