{
  "schema": "lee3d.profile/v1",
  "units": "mm",
  "name": "example-charger",
  "category": "Car frame",
  "length": 199,
  "stations": 80,
  "arcSegments": 64,
  "roofFlatness": 1.6,
  "wallThickness": 1.8,
  "topProfile": [
    [
      0,
      26.01422997475327
    ],
    [
      0.022727272727272728,
      30.957539591462016
    ],
    [
      0.045454545454545456,
      37.7864192268599
    ],
    [
      0.06818181818181818,
      39.93022722056461
    ],
    [
      0.09090909090909091,
      43.404177186137254
    ],
    [
      0.11363636363636365,
      46.32774845076887
    ],
    [
      0.13636363636363635,
      48.29194399816387
    ],
    [
      0.1590909090909091,
      50.18184202760746
    ],
    [
      0.18181818181818182,
      51.60431489557034
    ],
    [
      0.20454545454545453,
      52.558641266926784
    ],
    [
      0.2272727272727273,
      53.9472113839798
    ],
    [
      0.25,
      55.245614610315094
    ],
    [
      0.2727272727272727,
      56.03764057837962
    ],
    [
      0.29545454545454547,
      56.44158824879505
    ],
    [
      0.3181818181818182,
      56.350700022951564
    ],
    [
      0.34090909090909094,
      60.89366864487361
    ],
    [
      0.36363636363636365,
      66.24741794812944
    ],
    [
      0.38636363636363635,
      71.10993803075512
    ],
    [
      0.40909090909090906,
      75.94216203809961
    ],
    [
      0.4318181818181818,
      80.45627725499196
    ],
    [
      0.4545454545454546,
      84.45103118135022
    ],
    [
      0.47727272727272724,
      83.01124627036953
    ],
    [
      0.5,
      87.33348634381454
    ],
    [
      0.5227272727272727,
      87.65664448014688
    ],
    [
      0.5454545454545454,
      85.48109774090953
    ],
    [
      0.5681818181818181,
      86.00045903144365
    ],
    [
      0.5909090909090909,
      86.69726876291026
    ],
    [
      0.6136363636363636,
      88
    ],
    [
      0.6363636363636364,
      87.59605232958458
    ],
    [
      0.6590909090909091,
      85.23440112790583
    ],
    [
      0.6818181818181819,
      84.92999770484278
    ],
    [
      0.7045454545454546,
      84.23318797337618
    ],
    [
      0.7272727272727273,
      82.09226532017443
    ],
    [
      0.75,
      79.525754942785
    ],
    [
      0.7727272727272727,
      76.54808354372274
    ],
    [
      0.7954545454545454,
      73.53867339912784
    ],
    [
      0.8181818181818181,
      70.32728941932523
    ],
    [
      0.8409090909090909,
      66.2777140234106
    ],
    [
      0.8636363636363636,
      63.3389947211384
    ],
    [
      0.8863636363636364,
      63.687399586871706
    ],
    [
      0.9090909090909092,
      64.87399586871702
    ],
    [
      0.9318181818181819,
      66.37870094101446
    ],
    [
      0.9545454545454545,
      67.71028558313387
    ],
    [
      0.9772727272727273,
      44.19692448932742
    ],
    [
      1,
      38.011475786091346
    ]
  ],
  "bottomProfile": [
    [
      0,
      15.350011475786092
    ],
    [
      0.022727272727272728,
      2.019738352077118
    ],
    [
      0.045454545454545456,
      2.019738352077118
    ],
    [
      0.06818181818181818,
      2.019738352077118
    ],
    [
      0.09090909090909091,
      2.019738352077118
    ],
    [
      0.11363636363636365,
      2.019738352077118
    ],
    [
      0.13636363636363635,
      0
    ],
    [
      0.1590909090909091,
      17.15911997114658
    ],
    [
      0.18181818181818182,
      32.19462933210925
    ],
    [
      0.20454545454545453,
      36.76428735368373
    ],
    [
      0.2272727272727273,
      42.43470277714024
    ],
    [
      0.25,
      41.43926030361651
    ],
    [
      0.2727272727272727,
      42.01055772320404
    ],
    [
      0.29545454545454547,
      42.475097544181786
    ],
    [
      0.3181818181818182,
      43.46476933669957
    ],
    [
      0.34090909090909094,
      39.93744057182202
    ],
    [
      0.36363636363636365,
      38.6779894422768
    ],
    [
      0.38636363636363635,
      34.84553591921047
    ],
    [
      0.40909090909090906,
      25.70117053018132
    ],
    [
      0.4318181818181818,
      9.67959605232957
    ],
    [
      0.4545454545454546,
      6.01882028918981
    ],
    [
      0.47727272727272724,
      6.01882028918981
    ],
    [
      0.5,
      0.6867110397062204
    ],
    [
      0.5227272727272727,
      4.721138397980306
    ],
    [
      0.5454545454545454,
      33.92583363388962
    ],
    [
      0.5681818181818181,
      41.70254762451228
    ],
    [
      0.5909090909090909,
      48.82717466146431
    ],
    [
      0.6136363636363636,
      53.11406931374799
    ],
    [
      0.6363636363636364,
      51.483130594445726
    ],
    [
      0.6590909090909091,
      52.84789665234925
    ],
    [
      0.6818181818181819,
      53.34128987835667
    ],
    [
      0.7045454545454546,
      53.34128987835667
    ],
    [
      0.7272727272727273,
      52.705072297452375
    ],
    [
      0.75,
      51.43696514639824
    ],
    [
      0.7727272727272727,
      49.22102364011935
    ],
    [
      0.7954545454545454,
      45.97934358503558
    ],
    [
      0.8181818181818181,
      40.859306862520086
    ],
    [
      0.8409090909090909,
      28.78415685760188
    ],
    [
      0.8636363636363636,
      12.986917603855854
    ],
    [
      0.8863636363636364,
      7.260959375717244
    ],
    [
      0.9090909090909092,
      8.392012852880443
    ],
    [
      0.9318181818181819,
      5.857241221023636
    ],
    [
      0.9545454545454545,
      10.918128463228284
    ],
    [
      0.9772727272727273,
      8.619233417489083
    ],
    [
      1,
      24.014689006196924
    ]
  ],
  "widthProfile": [
    [
      0,
      18.453020134228186
    ],
    [
      0.022727272727272728,
      47.99748322147651
    ],
    [
      0.045454545454545456,
      51.43288590604026
    ],
    [
      0.06818181818181818,
      52.21812080536913
    ],
    [
      0.09090909090909091,
      54.5738255033557
    ],
    [
      0.11363636363636363,
      55.293624161073815
    ],
    [
      0.13636363636363635,
      56.53691275167785
    ],
    [
      0.1590909090909091,
      56.41912751677852
    ],
    [
      0.18181818181818182,
      57.400671140939586
    ],
    [
      0.20454545454545456,
      56.471476510067106
    ],
    [
      0.22727272727272727,
      58.26442953020133
    ],
    [
      0.25,
      58.5
    ],
    [
      0.2727272727272727,
      58.5
    ],
    [
      0.29545454545454547,
      58.5
    ],
    [
      0.3181818181818182,
      57.08657718120804
    ],
    [
      0.3409090909090909,
      55.26090604026845
    ],
    [
      0.36363636363636365,
      56.45838926174497
    ],
    [
      0.38636363636363635,
      55.86946308724833
    ],
    [
      0.4090909090909091,
      56.37986577181209
    ],
    [
      0.4318181818181818,
      55.58808724832214
    ],
    [
      0.45454545454545453,
      55.35906040268456
    ],
    [
      0.4772727272727273,
      55.35906040268456
    ],
    [
      0.5,
      55.35906040268456
    ],
    [
      0.5227272727272727,
      55.28053691275168
    ],
    [
      0.5454545454545454,
      53.788590604026844
    ],
    [
      0.5681818181818182,
      53.788590604026844
    ],
    [
      0.5909090909090909,
      54.966442953020135
    ],
    [
      0.6136363636363636,
      58.06812080536911
    ],
    [
      0.6363636363636364,
      58.5
    ],
    [
      0.6590909090909091,
      53.59228187919463
    ],
    [
      0.6818181818181818,
      50.647651006711406
    ],
    [
      0.7045454545454546,
      50.647651006711406
    ],
    [
      0.7272727272727273,
      51.43288590604026
    ],
    [
      0.75,
      58.20553691275168
    ],
    [
      0.7727272727272727,
      58.5
    ],
    [
      0.7954545454545454,
      58.33640939597314
    ],
    [
      0.8181818181818182,
      57.71476510067114
    ],
    [
      0.8409090909090909,
      57.439932885906046
    ],
    [
      0.8636363636363636,
      56.53691275167785
    ],
    [
      0.8863636363636364,
      55.71895973154363
    ],
    [
      0.9090909090909091,
      54.88791946308726
    ],
    [
      0.9318181818181818,
      52.80704697986577
    ],
    [
      0.9545454545454546,
      52.21812080536913
    ],
    [
      0.9772727272727273,
      47.408557046979865
    ],
    [
      1,
      10.600671140939598
    ]
  ],
  "section": [
    [
      0,
      0
    ],
    [
      0.04,
      0.6581997970423905
    ],
    [
      0.06090909090909091,
      0.6707660930775243
    ],
    [
      0.08181818181818182,
      0.6833323891126583
    ],
    [
      0.10272727272727272,
      0.7013586931386823
    ],
    [
      0.14454545454545453,
      0.8002561050267272
    ],
    [
      0.16545454545454547,
      0.8507455651272889
    ],
    [
      0.18636363636363634,
      0.9037742912950164
    ],
    [
      0.20727272727272728,
      0.9454221668643523
    ],
    [
      0.22818181818181815,
      0.9536627989295691
    ],
    [
      0.24909090909090909,
      0.9619034309947857
    ],
    [
      0.27,
      0.9701440630600027
    ],
    [
      0.2909090909090909,
      0.9783846951252194
    ],
    [
      0.33272727272727265,
      0.9871021918848638
    ],
    [
      0.3536363636363636,
      0.9898282721122142
    ],
    [
      0.3745454545454545,
      0.9921046461550999
    ],
    [
      0.3954545454545454,
      0.9940784846163251
    ],
    [
      0.41636363636363627,
      0.9960523230775501
    ],
    [
      0.43727272727272726,
      0.998026161538775
    ],
    [
      0.45818181818181813,
      1
    ],
    [
      0.479090909090909,
      0.9988174852404165
    ],
    [
      0.5209090909090909,
      0.9948060855459857
    ],
    [
      0.5418181818181819,
      0.9928003856987702
    ],
    [
      0.5627272727272726,
      0.9914933288829983